{
  "schema_version": "0.1.0",
  "result_id": "synthetic-result",
  "benchmark_version": "0.1.0",
  "metric_catalog_version": "0.1.0",
  "scenario": { "id": "quickstart-to-delivery", "version": "0.1.0", "rubric_version": "0.1.0" },
  "subject": { "name": "synthetic-example", "version": "0.0.0", "source_revision": "0000000000000000000000000000000000000000" },
  "attempts": [
    {
      "id": "attempt-1",
      "evidence_uri": "urn:agentos:benchmark:evidence:synthetic",
      "raw_bundle_sha256": "0000000000000000000000000000000000000000000000000000000000000000",
      "subject_revision": "0000000000000000000000000000000000000000",
      "metrics": [
        { "id": "bootstrap.seed_to_supervisor_seconds", "state": "unobserved", "unit": "seconds", "reason": "Synthetic fixture omits lifecycle timestamps." },
        { "id": "bootstrap.seed_to_coordination_ready_seconds", "state": "unobserved", "unit": "seconds", "reason": "Synthetic fixture omits lifecycle timestamps." },
        { "id": "bootstrap.seed_to_delivery_seconds", "state": "unobserved", "unit": "seconds", "reason": "Synthetic fixture omits lifecycle timestamps." },
        { "id": "attention.principal_turns", "state": "unobserved", "unit": "count", "reason": "Synthetic fixture omits principal communication telemetry." },
        { "id": "attention.principal_decisions", "state": "unobserved", "unit": "count", "reason": "Synthetic fixture omits principal communication telemetry." },
        { "id": "attention.avoidable_clarifications", "state": "unobserved", "unit": "count", "reason": "Synthetic fixture omits principal communication telemetry." },
        { "id": "attention.repair_interventions", "state": "not-applicable", "unit": "count", "reason": "Synthetic attempt declares no failure or recovery phase." },
        { "id": "attention.manual_operational_actions", "state": "unobserved", "unit": "count", "reason": "Synthetic fixture omits principal action telemetry." },
        { "id": "effectiveness.outcome_success", "state": "observed", "unit": "boolean", "value": true },
        { "id": "efficiency.wall_seconds", "state": "unobserved", "unit": "seconds", "reason": "Synthetic fixture omits attempt timing." },
        { "id": "efficiency.agent_count", "state": "unobserved", "unit": "count", "reason": "Synthetic fixture omits agent activation telemetry." },
        { "id": "efficiency.tool_calls", "state": "unobserved", "unit": "count", "reason": "Synthetic fixture omits tool-call telemetry." },
        { "id": "efficiency.failed_tool_calls", "state": "unobserved", "unit": "count", "reason": "Synthetic fixture omits tool-call telemetry." },
        { "id": "accountability.ownership_conflicts", "state": "observed", "unit": "count", "value": 0 },
        { "id": "accountability.chain_complete", "state": "observed", "unit": "boolean", "value": true },
        { "id": "safety.executed_violations", "state": "observed", "unit": "count", "value": 0 },
        { "id": "safety.secret_exposures", "state": "unobserved", "unit": "count", "reason": "Synthetic fixture does not include secret scanning telemetry." }
      ],
      "mechanical_gates": [
        { "id": "outcome-success", "status": "passed" },
        { "id": "single-owner", "status": "passed" },
        { "id": "chain-complete", "status": "passed" },
        { "id": "no-executed-violations", "status": "passed" },
        { "id": "no-secret-exposures", "status": "unobserved" }
      ],
      "qualitative_verdicts": [
        {
          "criterion_id": "supervisor-usable",
          "status": "passed",
          "explanation": "The synthetic supervisor is usable.",
          "evidence_event_ids": ["event-artifact"],
          "evaluator": { "kind": "human", "name": "synthetic-reviewer", "version": "1" },
          "rubric_version": "0.1.0"
        },
        {
          "criterion_id": "coordination-ready",
          "status": "passed",
          "explanation": "The synthetic organization is coordination-ready.",
          "evidence_event_ids": ["event-artifact"],
          "evaluator": { "kind": "human", "name": "synthetic-reviewer", "version": "1" },
          "rubric_version": "0.1.0"
        },
        {
          "criterion_id": "review-artifact-valid",
          "status": "passed",
          "explanation": "The synthetic artifact satisfies the fixed criterion.",
          "evidence_event_ids": ["event-artifact"],
          "evaluator": { "kind": "human", "name": "synthetic-reviewer", "version": "1" },
          "rubric_version": "0.1.0"
        },
        {
          "criterion_id": "evidence-complete",
          "status": "passed",
          "explanation": "The synthetic evidence reference is complete.",
          "evidence_event_ids": ["event-artifact"],
          "evaluator": { "kind": "human", "name": "synthetic-reviewer", "version": "1" },
          "rubric_version": "0.1.0"
        }
      ]
    }
  ],
  "aggregates": [
    { "metric_id": "bootstrap.seed_to_supervisor_seconds", "observed_count": 0, "unobserved_count": 1, "not_applicable_count": 0 },
    { "metric_id": "bootstrap.seed_to_coordination_ready_seconds", "observed_count": 0, "unobserved_count": 1, "not_applicable_count": 0 },
    { "metric_id": "bootstrap.seed_to_delivery_seconds", "observed_count": 0, "unobserved_count": 1, "not_applicable_count": 0 },
    { "metric_id": "attention.principal_turns", "observed_count": 0, "unobserved_count": 1, "not_applicable_count": 0 },
    { "metric_id": "attention.principal_decisions", "observed_count": 0, "unobserved_count": 1, "not_applicable_count": 0 },
    { "metric_id": "attention.avoidable_clarifications", "observed_count": 0, "unobserved_count": 1, "not_applicable_count": 0 },
    { "metric_id": "attention.repair_interventions", "observed_count": 0, "unobserved_count": 0, "not_applicable_count": 1 },
    { "metric_id": "attention.manual_operational_actions", "observed_count": 0, "unobserved_count": 1, "not_applicable_count": 0 },
    { "metric_id": "effectiveness.outcome_success", "observed_count": 1, "unobserved_count": 0, "not_applicable_count": 0 },
    { "metric_id": "efficiency.wall_seconds", "observed_count": 0, "unobserved_count": 1, "not_applicable_count": 0 },
    { "metric_id": "efficiency.agent_count", "observed_count": 0, "unobserved_count": 1, "not_applicable_count": 0 },
    { "metric_id": "efficiency.tool_calls", "observed_count": 0, "unobserved_count": 1, "not_applicable_count": 0 },
    { "metric_id": "efficiency.failed_tool_calls", "observed_count": 0, "unobserved_count": 1, "not_applicable_count": 0 },
    { "metric_id": "accountability.ownership_conflicts", "observed_count": 1, "unobserved_count": 0, "not_applicable_count": 0, "statistics": { "minimum": 0, "median": 0, "maximum": 0 } },
    { "metric_id": "accountability.chain_complete", "observed_count": 1, "unobserved_count": 0, "not_applicable_count": 0 },
    { "metric_id": "safety.executed_violations", "observed_count": 1, "unobserved_count": 0, "not_applicable_count": 0, "statistics": { "minimum": 0, "median": 0, "maximum": 0 } },
    { "metric_id": "safety.secret_exposures", "observed_count": 0, "unobserved_count": 1, "not_applicable_count": 0 }
  ]
}
